{
  "$schema": "https://json-schema.org/draft/2020-12/schema",
  "$id": "https://github.com/vassiliylakhonin/agenda-intelligence-md/schemas/v1/pre-action-check-request.schema.json",
  "title": "PreActionCheckRequest",
  "description": "Caller-supplied action context and claim evidence for deterministic pre-action routing. The check can continue, request evidence, require human approval, or stop. It does not authenticate the actor, verify factual truth, enforce the decision, or authorize the action.",
  "x-schema-version": "1",
  "type": "object",
  "additionalProperties": false,
  "required": [
    "run_id",
    "actor",
    "requested_action",
    "target",
    "risk_tier",
    "claims",
    "evidence"
  ],
  "properties": {
    "run_id": {
      "type": "string",
      "minLength": 1,
      "description": "Caller-generated correlation identifier. Resubmit the same run_id after adding evidence or approval."
    },
    "actor": {
      "$ref": "#/$defs/actor"
    },
    "requested_action": {
      "type": "string",
      "minLength": 1
    },
    "target": {
      "$ref": "#/$defs/target"
    },
    "risk_tier": {
      "type": "string",
      "enum": [
        "low",
        "medium",
        "high",
        "critical"
      ]
    },
    "claims": {
      "type": "array",
      "minItems": 1,
      "items": {
        "$ref": "#/$defs/claim"
      }
    },
    "evidence": {
      "type": "array",
      "items": {
        "$ref": "#/$defs/evidence_item"
      }
    },
    "unsupported_claims": {
      "type": "array",
      "items": {
        "type": "string"
      }
    },
    "policy_context": {
      "$ref": "#/$defs/policy_context"
    },
    "approval": {
      "$ref": "#/$defs/approval"
    }
  },
  "$defs": {
    "actor": {
      "type": "object",
      "additionalProperties": false,
      "required": [
        "id",
        "type"
      ],
      "properties": {
        "id": {
          "type": "string",
          "minLength": 1
        },
        "type": {
          "type": "string",
          "enum": [
            "ai_agent",
            "automation",
            "api_client",
            "human_delegated_agent",
            "unknown",
            "other"
          ]
        },
        "operator": {
          "type": "string",
          "minLength": 1
        }
      }
    },
    "target": {
      "type": "object",
      "additionalProperties": false,
      "required": [
        "id",
        "type"
      ],
      "properties": {
        "id": {
          "type": "string",
          "minLength": 1
        },
        "type": {
          "type": "string",
          "minLength": 1
        }
      }
    },
    "claim": {
      "type": "object",
      "additionalProperties": false,
      "required": [
        "claim_id",
        "claim",
        "support_level"
      ],
      "properties": {
        "claim_id": {
          "type": "string",
          "minLength": 1
        },
        "claim": {
          "type": "string",
          "minLength": 1
        },
        "claim_type": {
          "type": "string",
          "enum": [
            "regulatory_change",
            "regulatory_gap",
            "sanctions_event",
            "geopolitical_event",
            "market_event",
            "industry_response",
            "corporate_disclosure",
            "capability_claim"
          ]
        },
        "evidence_ids": {
          "type": "array",
          "items": {
            "type": "string"
          }
        },
        "support_level": {
          "type": "string",
          "enum": [
            "direct",
            "partial",
            "weak",
            "unsupported"
          ]
        },
        "uncertainty": {
          "type": "string"
        },
        "risk_if_wrong": {
          "type": "string"
        },
        "supporting_quotes": {
          "type": "array",
          "items": {
            "type": "object",
            "additionalProperties": false,
            "required": [
              "evidence_id",
              "quote"
            ],
            "properties": {
              "evidence_id": {
                "type": "string",
                "minLength": 1
              },
              "quote": {
                "type": "string",
                "minLength": 1
              }
            }
          }
        }
      }
    },
    "evidence_item": {
      "type": "object",
      "additionalProperties": false,
      "required": [
        "evidence_id",
        "source_type"
      ],
      "properties": {
        "evidence_id": {
          "type": "string",
          "minLength": 1
        },
        "name": {
          "type": "string"
        },
        "url": {
          "type": "string"
        },
        "source_type": {
          "type": "string",
          "minLength": 1
        },
        "freshness": {
          "type": "string"
        },
        "supports": {
          "type": "array",
          "items": {
            "type": "string"
          }
        },
        "limits": {
          "type": "array",
          "items": {
            "type": "string"
          }
        },
        "content": {
          "type": "string",
          "description": "Optional source text extract. supporting_quotes corroborate only by matching their text against evidence content fields; without one, quotes are caller assertions."
        },
        "text": {
          "type": "string",
          "description": "Alias content field; treated like 'content' for quote corroboration."
        },
        "body": {
          "type": "string",
          "description": "Alias content field; treated like 'content' for quote corroboration."
        },
        "excerpt": {
          "type": "string",
          "description": "Alias content field; treated like 'content' for quote corroboration."
        },
        "quote": {
          "type": "string",
          "description": "Alias content field; treated like 'content' for quote corroboration."
        },
        "snippet": {
          "type": "string",
          "description": "Alias content field; treated like 'content' for quote corroboration."
        },
        "summary": {
          "type": "string",
          "description": "Alias content field; treated like 'content' for quote corroboration."
        },
        "full_text": {
          "type": "string",
          "description": "Alias content field; treated like 'content' for quote corroboration."
        }
      }
    },
    "policy_context": {
      "type": "object",
      "additionalProperties": false,
      "properties": {
        "profile": {
          "type": "string",
          "enum": [
            "default",
            "agentic_interaction_trust"
          ]
        },
        "checks": {
          "type": "array",
          "items": {
            "type": "object",
            "additionalProperties": false,
            "required": [
              "check_id",
              "status"
            ],
            "properties": {
              "check_id": {
                "type": "string",
                "minLength": 1
              },
              "status": {
                "type": "string",
                "enum": [
                  "passed",
                  "needs_evidence",
                  "failed"
                ]
              },
              "evidence_gap": {
                "type": "string",
                "minLength": 1
              }
            }
          }
        }
      }
    },
    "approval": {
      "type": "object",
      "additionalProperties": false,
      "required": [
        "status"
      ],
      "properties": {
        "status": {
          "type": "string",
          "enum": [
            "not_requested",
            "approved",
            "rejected"
          ]
        },
        "reference": {
          "type": "string",
          "minLength": 1,
          "description": "Opaque caller-held reference to an external approval record."
        }
      }
    }
  }
}
